product_id,full_price,discounted,current_price,product_url,description,ratings,reviews
DQ0284-114,85,False,85.0,https://www.nike.com/t/air-max-systm-big-kids-shoes-jh1PDw/DQ0284-114,"Cassette mixtapes, music videos and mall arcades—the '80s had it all. We’re celebrating that gnarly era with the Nike Air Max SYSTM. From the big and bold Air unit in the heel to design lines inspired by our favorite throwback Air Max shoes, these kicks are all about bringing back what’s cool and introducing it to a new generation.Shown: White/Phantom/Photon Dust/Total OrangeStyle: DQ0284-114",4.8 Stars,185
FJ2557-001,60,False,60.0,https://www.nike.com/t/phantom-gx-2-club-mg-low-top-soccer-cleats-1x5QGf/FJ2557-001,"Whether you’re starting out or just playing for fun, Club cleats get you on the field without compromising on quality. Created with goals in mind, the Phantom GX 2 Club has a grippy texture covering the striking area of the cleat and reliable traction to help guide your unscripted agility.Shown: Black/BlackStyle: FJ2557-001",5 Stars,3
FJ3145-002,160,False,160.0,https://www.nike.com/t/air-max-dn-womens-shoes-dFBSQh/FJ3145-002,"Say hello to the next generation of Air technology. The Air Max Dn features our Dynamic Air unit system of dual-pressure tubes, creating a reactive sensation with every step. This results in a futuristic design that’s comfortable enough to wear from day to night. Go ahead—Feel the Unreal.Shown: Black/Cool Grey/Pure Platinum/WhiteStyle: FJ3145-002",4.7 Stars,38
DZ6895-003,67,False,67.0,https://www.nike.com/t/roshe-2-g-jr-little-big-kids-golf-shoes-n5C8DG/DZ6895-003,"There's lots of reasons to get excited about your next tee time or practicing your game at the range. The Nike Roshe 2 golf shoes give you another reason to get hyped. They're super breathable so your feet stay cool and comfy under the hot sun. Plus, the rubber sole digs into the grass (without needing spikes) and brings the traction everywhere from the fairway to the rough and concrete cart paths.Shown: Sea Glass/Black/White/Stadium GreenStyle: DZ6895-003",4.9 Stars,7
DD9472-040,100,True,75.97,https://www.nike.com/t/phantom-gx-academy-multi-ground-high-top-soccer-cleats-fg6cTd/DD9472-040,"Looking to take your game to the next level? Academy cleats give you the precision touch you need to let your innermost playing instincts dazzle. Featuring NikeSkin and a mesh touch zone to help enhance your precision and an agility plate that’s designed to swerve and sprint with you, it’s ready to ignite your spontaneous playmaking spirit. This version has a Dynamic Fit collar, which wraps your ankle in soft, stretchy fabric for a secure feel.﻿Shown: Black/Hyper Royal/ChromeStyle: DD9472-040",4.6 Stars,71
FN0028-401,55,False,55.0,https://www.nike.com/t/alpha-menace-4-shark-football-cleats-R3RCjP/FN0028-401,"Change the game in a flash with the Alpha Menace 4 Shark. With breathable mesh and synthetic leather harmonizing perfectly with our Nike Fastflex technology, it can help you make a game-saving tackle or hightail it to pay dirt.Shown: Midnight Navy/Metallic Silver/Obsidian/WhiteStyle: FN0028-401",0 Stars,0
AT5889-004,120,True,100.97,https://www.nike.com/t/nikepremier-3-firm-ground-soccer-cleats-SZHrPF/AT5889-004,The Nike Premier 3 gets back to the basics with a timeless silhouette wrapped in supple real and synthetic leather—helping you to move confidently as an unstoppable force on the field.Shown: Metallic Silver/Volt/BlackStyle: AT5889-004,4.6 Stars,75
DZ3309-104,65,False,65.0,https://www.nike.com/t/air-max-1-easyon-baby-toddler-shoes-JXdHSC/DZ3309-104,"Made for kids (and their squirmy feet), these Air Max Shoes have an easy-on system that makes putting them on a breeze. The laces are just for show—the entire lace area lifts up, making a large slip-in space, so getting their shoes on doesn’t have to be a struggle.Shown: White/Neutral Grey/Black/Game RoyalStyle: DZ3309-104",5 Stars,4
FD0088-100,130,False,130.0,https://www.nike.com/t/huarache-9-elite-lax-lacrosse-cleats-r025t2/FD0088-100,"Take it to the rack in the Huarache 9 Elite. Whether you’re ripping around the cage, going coast-to-coast or scooping up the ball on a dead run, these cleats can help you decide the result. We loaded it with multidirectional traction and made it more flexible compared to the 8, so you can impact the game from any position.Shown: White/White/Metallic Vivid GoldStyle: FD0088-100",0 Stars,0
DV4351-700,57,False,57.0,https://www.nike.com/t/jr-tiempo-legend-10-academy-little-big-kids-turf-low-top-soccer-shoes-h7Vsvr/DV4351-700,"Even Legends find ways to evolve. Made to take your game to the next level, the latest iteration of these Academy shoes has all-new FlyTouch Lite engineered leather. Softer than natural leather, it conforms to your foot and doesn't overstretch, so you can dictate the pace of your game. Lighter and sleeker than any other Tiempo to date, the Legend 10 is for any position on the field, whether you're sending a pinpoint pass through the defense or tracking back to stop a breakaway.Shown: Lemonade/Metallic Gold Coin/BlackStyle: DV4351-700",4.8 Stars,23
DZ3547-004,140,False,140.0,https://www.nike.com/t/versair-womens-workout-shoes-XxrnT6/DZ3547-004,"What's on the agenda today? Legs? Cardio? Fitness class? In the agile and flexible Versair, you can get after a wide range of workouts. Low to the ground and featuring a Zoom Air unit designed with female athletes in mind, it's ideal for wherever your fitness journey takes you.Shown: Platinum Violet/White/Light Violet Ore/Metallic PlatinumStyle: DZ3547-004",4.6 Stars,16
DX9043-003,50,False,50.0,https://www.nike.com/t/tanjun-easyon-baby-toddler-shoes-Lpnk7T/DX9043-003,"Made for kids (and their squirmy feet), these Air Max Shoes have an easy-on system that makes putting them on a breeze. The laces are just for show—the entire lace area lifts up, making a large slip-in space, so getting their shoes on doesn’t have to be a struggle.Shown: Black/White/WhiteStyle: DX9043-003",4.7 Stars,38
DZ3309-111,65,True,42.97,https://www.nike.com/t/air-max-1-easyon-baby-toddler-shoes-CskhV7/DZ3309-111,"Made for kids (and their squirmy feet), these Air Max Shoes have an easy-on system that makes putting them on a breeze. The laces are just for show—the entire lace area lifts up, making a large slip-in space, so getting their shoes on doesn’t have to be a struggle.Shown: White/Dark Team Red Heather/Pure Platinum/BlackStyle: DZ3309-111",5 Stars,4
FN0228-700,90,False,90.0,https://www.nike.com/t/journey-run-mens-road-running-shoes-Qg3sJk/FN0228-700,"Enjoy every step, route and jaunt in the Nike Journey Run. It’ll have you striding and smiling on punishing pavements, thanks to extra-high foam stacks supersoft ComfiRide cushioning. It's so comfortable that you'll already be looking forward to lacing 'em up again.Shown: Barely Volt/Volt/White/BlackStyle: FN0228-700",5 Stars,2
DJ5615-700,72,True,49.97,https://www.nike.com/t/jr-mercurial-superfly-9-academy-little-big-kids-indoor-court-high-top-soccer-shoes-ftWCVZ/DJ5615-700,"You've got the skills, you've got the game. Now show them off with the Nike Jr. soccer shoes. Designed for speed and agility, Zoom Air units help absorb impact and give you snappy cushioning. Pull tabs and dual straps combine for an easy-on design that eliminates the need for laces and helps get you on the pitch fast.Shown: Lemonade/BlackStyle: DJ5615-700",5 Stars,3
DZ0502-001,75,False,75.0,https://www.nike.com/t/air-diamond-varsity-turf-mens-baseball-shoes-FHBH4v/DZ0502-001,"Add some vibrant pop to your pregame routine, and put your opponents on notice that’s it going to be a long day once the first pitch is thrown. Whether you’re stepping into a long-toss session, jacking balls in the cage, or working on your takeoff from 1st to 2nd, these shoes can get you game-ready with flair on your feet.Shown: Wolf Grey/Cool Grey/Pure Platinum/WhiteStyle: DZ0502-001",4.6 Stars,5
FD0090-100,85,False,85.0,https://www.nike.com/t/huarache-9-varsity-lax-lacrosse-cleats-Z0tsjC/FD0090-100,"Take it to the rack in the Huarache 9 Varsity. Designed for both offensive-minded playmakers and defensive aces alike, these cleats deliver flexibility, speed and comfort so you can play well from anywhere on the field. The light, breathable upper and multidirectional support help keep you fresh for your match.Shown: White/White/Metallic Vivid GoldStyle: FD0090-100",0 Stars,0
DM9027-107,62,False,62.0,https://www.nike.com/t/omni-multi-court-big-kids-indoor-court-shoes-xbrQcw/DM9027-107,"What’s Omni, you ask? It means universal, inclusive and all—like for all your indoor sport needs. Durable and lightweight, they help make moving fast feel easy. Choose their favorite indoor court activity—volleyball, basketball, tennis, handball, or gym class—and lace up!Shown: White/Vapor Green/Total Orange/Photo BlueStyle: DM9027-107",4.5 Stars,50
DX2498-600,105,True,89.97,https://www.nike.com/t/air-zoom-pegasus-40-big-kids-road-running-shoes-lQJf8F/DX2498-600,"40 years. Generations of running. The Pegasus 40 reps the past and future of Nike running. Whether you're gearing up for a school track meet, track practice or fun runs (like your gym class mile), this shoe is for runners of all levels. They're breathable so your feet stay cool with every lap. Zoom Air and bouncy foam team up for the cushioning you need to feel comfortable with every stride. It's time to fly!Shown: Coral Chalk/Citron Pulse/Sea Coral/WhiteStyle: DX2498-600",4.7 Stars,98
DH5088-401,55,False,55.0,https://www.nike.com/t/vapor-edge-shark-2-mens-football-cleats-dmdfQS/DH5088-401,"The Nike Vapor Edge Shark 2 helps you smoke your competition with speed, power and finesse while feeling fully stabilized and secure. Rubber traction and a synthetic material add support while Nike Fastflex technology lets you move with ease while running and shifting gears.Shown: Midnight Navy/White/BlackStyle: DH5088-401",4.3 Stars,3
CZ5918-103,45,False,45.0,https://www.nike.com/t/hyperdiamond-4-keystone-womens-softball-cleats-6gFh7z/CZ5918-103,"The Nike Hyperdiamond 4 Keystone is all about lightweight comfort on the diamond. Molded details on the upper add durability, while a flexible rubber sole with studs helps give you traction throughout the game or practice.Shown: White/Photon Dust/Volt/BlackStyle: CZ5918-103",4.7 Stars,183
DV5457-005,57,False,57.0,https://www.nike.com/t/court-borough-low-recraft-little-kids-shoes-tXD6p2/DV5457-005,"Start little ones off on the right foot with new Court Borough. Made for the long haul, this ""recrafted"" legend uses a combination of durable materials on the upper and outsole to achieve a classic look made in a whole new way. A redesigned toe box and midfoot give feet a little extra room so littles can run, jump and play just a bit longer and harder in comfort.Shown: Light Iron Ore/White/Photo Blue/Vapor GreenStyle: DV5457-005",4.9 Stars,234
FN0324-001,80,False,80.0,https://www.nike.com/t/precision-7-easyon-mens-basketball-shoes-6jgrl7/FN0324-001,"Step onto the floor with full confidence, and take your best shot in the Nike Precision 7—a game-ready basketball shoe for everyone. Made with Nike EasyOn technology, it has a collapsible heel and large midfoot strap to help you tighten the laces and secure the fit using one hand. Fasten the strap in a matter of seconds, check in and make the plays that swing the outcome in your favor.Shown: Black/University Red/WhiteStyle: FN0324-001",0 Stars,0
DV4337-300,85,True,72.97,https://www.nike.com/t/tiempo-legend-10-academy-multi-ground-low-top-soccer-cleats-PVVHhx/DV4337-300,"Even Legends find ways to evolve. Made to take your game to the next level, the latest iteration of these Academy cleats has all-new FlyTouch Lite engineered leather. Softer than natural leather, it conforms to your foot and doesn't overstretch, so you can dictate the pace of your game. Lighter and sleeker than any other Tiempo to date, the Legend 10 is for any position on the field, whether you're sending a pinpoint pass through the defense or tracking back to stop a breakaway.Shown: Hyper Turquoise/Fuchsia Dream/BlackStyle: DV4337-300",4.4 Stars,25
FV3526-010,170,False,170.0,https://www.nike.com/t/cosmic-unity-3-womens-basketball-shoes-7lZ9Zp/FV3526-010,"Better for your game, designed with sustainability in mind—two things you care about—the Cosmic Unity 3 has a secure, lightweight design for a low-to-the-ground feel. It gives you cloud-like cushioning for explosive speed and quick changes in direction, the difference-makers in a game that’s becoming more extraterrestrial. We used insights from female athletes to create a shoe that helps you play quickly and with confidence—which every basketball player needs.Shown: Football Grey/Ashen Slate/Light Carbon/WhiteStyle: FV3526-010",5 Stars,1
FD2148-003,120,False,120.0,https://www.nike.com/t/flyknit-haven-womens-shoes-x7fQ3k/FD2148-003,"Say hello to Haven—a cozy shoe all about relaxing and recharging. This new silhouette features an adjustable and collapsible collar, so you can easily slip on and go. From chilling at home to brunching with friends, its pillowy Flyknit material serves both versatile style and premium comfort. Who said you have to sacrifice being stylish for being cozy? Not us.Shown: Platinum Violet/Taupe Grey/Flat Pewter/EarthStyle: FD2148-003",4.2 Stars,24
DJ5958-700,47,True,34.97,https://www.nike.com/t/jr-mercurial-vapor-15-club-little-big-kids-multi-ground-low-top-soccer-cleats-NtmsBn/DJ5958-700,"Learn all the skills and drills, and use them in your next game with the Nike Jr. Mercurial Vapor 15 Club cleats. Made for all different surfaces from artificial to real grass fields, they have the traction you need to move and run up the field. The durable design is meant to hold up through every practice and every minute on game day.Shown: Lemonade/BlackStyle: DJ5958-700",4.7 Stars,42
DV4340-300,85,True,70.97,https://www.nike.com/t/tiempo-legend-10-academylow-top-soccer-cleats-P6NXdH/DV4340-300,"Even Legends find ways to evolve. Made to take your game to the next level, the latest iteration of these Academy cleats has all-new FlyTouch Lite engineered leather. Softer than natural leather, it conforms to your foot and doesn't overstretch, so you can dictate the pace of your game. Lighter and sleeker than any other Tiempo to date, the Legend 10 is for any position on the field, whether you're sending a pinpoint pass through the defense or tracking back to stop a breakaway.Shown: Hyper Turquoise/Fuchsia Dream/BlackStyle: DV4340-300",0 Stars,0
FD2599-400,85,True,56.97,https://www.nike.com/t/roshe-g-next-nature-mens-golf-shoes-CdMxPX/FD2599-400,"When the sun’s beating down your back and your drive just landed in the bunker, lean into the Roshe 2, a design that can help you find your peace when your round isn't going your way. It’s inherently simple and stylish, breathable and comfortable, perfect for playing in those sizzling-hot months. A full mesh upper and a soft, lightweight foam midsole form a cushioned combination to help maintain your internal calm, even if your game goes in the gutter.Shown: Ocean Bliss/Mineral Teal/Citron Tint/WhiteStyle: FD2599-400",5 Stars,2
DD9473-300,90,True,74.97,https://www.nike.com/t/phantom-gx-academy-multi-ground-low-top-soccer-cleats-1810WZ/DD9473-300,"Looking to take your game to the next level? Academy cleats give you the precision touch you need to let your innermost playing instincts dazzle. Featuring NikeSkin and a mesh touch zone to help enhance your precision and an agility plate that’s designed to swerve and sprint with you, it’s ready to ignite your spontaneous playmaking spirit.Shown: Hyper Turquoise/Fuchsia Dream/White/BlackStyle: DD9473-300",4.6 Stars,35
DM9028-001,52,True,32.97,https://www.nike.com/t/omni-multi-court-baby-toddler-shoes-xqkfzB/DM9028-001,"What’s Omni, you ask? It means universal, inclusive and all. Playtime is about freedom and imagination. As the ultimate play shoe, there are no limits when your kiddo pulls these Nikes on. They’re durable for any indoor surface (hint: helpful for early walkers), and lightweight to make getting around easy.Shown: Black/AnthraciteStyle: DM9028-001",3 Stars,2
DM9073-700,160,True,89.97,https://www.nike.com/t/air-max-flyknit-racer-womens-shoes-m3w0cV/DM9073-700,"Throw tradition out the door? Never. Paying homage to both heritage and innovation, we've blended two icons to go beyond what's expected. Light, airy Flyknit pairs beautifully with oh-so-comfy Air Max cushioning. Lace up and let your feet do the talking.Shown: Volt/White/Sequoia/BlackStyle: DM9073-700",4.5 Stars,142
FD6723-100,90,True,64.97,https://www.nike.com/t/phantom-gx-2-academy-mg-low-top-soccer-cleats-hMcXSW/FD6723-100,"Looking to take your game to the next level? The Phantom GX 2 Academy helps put you in prime position of the net, whether you're the organizer, assister or finisher. The rest is up to you. Created with goals in mind, NikeSkin covers the striking area of the cleat while Nike Cyclone 360 traction helps guide your unscripted agility.Shown: White/Metallic Gold Coin/BlackStyle: FD6723-100",5 Stars,2
DV7775-101,70,False,70.0,https://www.nike.com/t/tanjun-easyon-mens-shoes-xPNgsR/DV7775-101,"Forget the hype—the Tanjun brings you simplicity at its best. This version features Nike EasyOn technology for a hands-free experience. The flexible heel collapses when you step in then snaps back into place, making it easy to slip on and off. Plus, the light and airy design is a go-to for daily wear.Shown: White/White/Volt/WhiteStyle: DV7775-101",4.6 Stars,17
FJ2601-100,52,False,52.0,https://www.nike.com/t/jr-phantom-luna-2-club-little-big-kids-mg-high-top-soccer-cleats-p5Z6fp/FJ2601-100,"Whether you’re starting out or just playing for fun, Club cleats get you on the field without compromising on quality. Created with goals in mind, the Jr. Phantom Luna 2 Club has a grippy texture covering the striking area of the cleat and reliable traction to help guide your unscripted agility.Shown: White/Metallic Gold Coin/BlackStyle: FJ2601-100",5 Stars,3
FJ2603-001,72,False,72.0,https://www.nike.com/t/jr-phantom-luna-2-academy-little-big-kids-mg-soccer-cleats-nLpHdL/FJ2603-001,"You’ve found the net, whether you set up a pal with a great pass or made a fantastic move. Now, go score. These cleats have a sticky texture where you kick the ball the hardest. That way you have control of your shot when the net is in range. We created it with goals in mind.Shown: Black/BlackStyle: FJ2603-001",0 Stars,0
FJ2583-001,140,False,140.0,https://www.nike.com/t/phantom-gx-2-pro-tf-low-top-soccer-shoes-qsssR4/FJ2583-001,"Serious about your game? We made this for you. In the middle of the storm, with chaos swirling all around you, you’ve calmly found the final third of the field, thanks to your uncanny mix of on-ball guile and grace. Go finish the job in the Phantom GX 2 Pro. Take your skills to the next level with some of Nike’s greatest innovations, like a stretchy Flyknit upper and Nike Cyclone 360 traction guiding your unscripted agility.Shown: Black/BlackStyle: FJ2583-001",3.7 Stars,3
FD4116-400,50,False,50.0,https://www.nike.com/t/calm-mens-slides-4hQGBf/FD4116-400,"Enjoy a calm, comfortable experience—no matter where your day off takes you. Made with soft yet responsive foam, these lightweight slides are easy to style and easy to pack. While the water-friendly design makes them ideal for the beach or pool, the minimalist look is elevated enough to wear around in the city. Time to slide in and check out.Shown: Game Royal/Game RoyalStyle: FD4116-400",4.4 Stars,265
FD6722-001,67,False,67.0,https://www.nike.com/t/jr-phantom-gx-2-academy-little-big-kids-mg-low-top-soccer-cleats-lMxlkR/FD6722-001,"Looking to take your game to the next level? The Jr. Phantom GX 2 Academy helps put you in prime position of the net, whether you're the organizer, assister or finisher. The rest is up to you.Shown: Black/BlackStyle: FD6722-001",4.5 Stars,15
FB9731-401,42,False,42.0,https://www.nike.com/t/force-trout-9-keystone-big-kids-baseball-cleats-Chljvz/FB9731-401,"You want to be great? Go do it all on the field, fast, with force, just like Mike Trout. The Trout 9 is lighter, stronger and more comfortable than the previous iteration. Most of all? It's now a low-top design, harkening back to Trout’s favorite cleat as a rookie. With a brand-new upper and a revamped midsole, it can help you leave a permanent imprint on the game. What’s your legacy going to be?Shown: Game Royal/Midnight Navy/Black/WhiteStyle: FB9731-401",4.5 Stars,2
FJ3451-001,120,True,81.97,https://www.nike.com/t/air-jordan-1-mid-se-big-kids-shoes-hfXjW4/FJ3451-001,"Take note: the adults in your life might have rules, but they also can inspire some amazing drip. Inspired by the wallpaper in MJ's childhood home, this AJ1 rocks bold florals and color-blocked canvas.Shown: Anthracite/Sail/Red Stardust/AnthraciteStyle: FJ3451-001",0 Stars,0
DA2725-600,135,True,75.97,https://www.nike.com/t/space-hippie-04-womens-shoes-PQFcRc/DA2725-600,"Space Hippie is a story of trash transformed. From the upper to the outsole, Space Hippie 04 is made of at least 25% recycled material by weight. Not only is it the most lightweight silhouette within the collection, its ‘Space Waste Yarn’ upper includes recycled content—made from recycled plastic bottles, t-shirts and yarn scraps—for a lower carbon footprint. A soft, Crater Foam midsole combines Nike grind with a blend of foams for stability and a unique aesthetic.Shown: Sweet Beet/Team Red/Photon Dust/BlackStyle: DA2725-600",4.7 Stars,57
FJ2552-001,90,False,90.0,https://www.nike.com/t/phantom-gx-2-academy-ag-low-top-soccer-cleats-x7RgsZ/FJ2552-001,"Looking to take your game to the next level? The Phantom GX 2 Academy helps put you in prime position of the net, whether you're the organizer, assister or finisher. The rest is up to you. Created with goals in mind, NikeSkin covers the striking area of the cleat while Nike Cyclone 360 traction helps guide your unscripted agility.Shown: Black/BlackStyle: FJ2552-001",5 Stars,1
DJ5955-040,47,False,47.0,https://www.nike.com/t/jr-mercurial-vapor-15-club-little-big-kids-indoor-court-low-top-soccer-shoes-hGnpbq/DJ5955-040,"Learn all the skills and drills, and use them in your next game with the Nike Jr. soccer shoes. Made for use in indoor gyms and street courts, they have the traction you need to stop quickly and run up the court. The durable design is meant to hold up through every practice and every minute on game day.Shown: Black/Hyper Royal/ChromeStyle: DJ5955-040",4.7 Stars,24
DQ8031-004,130,False,130.0,https://www.nike.com/t/air-huarache-craft-womens-shoes-Cp4dSR/DQ8031-004,"When it fits this good and looks this great, there's no question—you're leading the charge. From its stretchy, foot-hugging fabric to its sporty, supportive heel cage, the Huarache Craft remasters everything you love best about the iconic shoe. Plus, its plush foam midsole and incredibly soft upper give your feet bragging rights.Shown: Sea Glass/Light Iron Ore/White/Lilac BloomStyle: DQ8031-004",4.3 Stars,139
DV7786-101,70,False,70.0,https://www.nike.com/t/tanjun-easyon-womens-shoes-ZSq68w/DV7786-101,"Forget the hype—the Tanjun brings you simplicity at its best. This version features Nike EasyOn technology for a hands-free experience. The flexible heel collapses when you step in then snaps back into place, making it easy to slip on and off. Plus, the light and airy design is a go-to for daily wear.Shown: White/White/Volt/WhiteStyle: DV7786-101",4.6 Stars,48
DV4348-100,57,True,46.97,https://www.nike.com/t/jr-tiempo-legend-10-academy-little-big-kids-multi-ground-low-top-soccer-cleats-3tpbSH/DV4348-100,"Even Legends find ways to evolve. Made to take your game to the next level, the latest iteration of these Academy cleats has all-new FlyTouch Lite engineered leather. Softer than natural leather, it conforms to your foot and doesn't overstretch, so you can dictate the pace of your game. Lighter and sleeker than any other Tiempo to date, the Legend 10 is for any position on the field, whether you're sending a pinpoint pass through the defense or tracking back to stop a breakaway.Shown: White/Bright Crimson/BlackStyle: DV4348-100",4.4 Stars,30
FJ2585-001,95,False,95.0,https://www.nike.com/t/phantom-luna-2-academy-ag-high-top-soccer-cleats-qrGnLq/FJ2585-001,"Looking to take your game to the next level? The Phantom Luna 2 Academy helps put you in prime position of the net, whether you're the organizer, assister or finisher. The rest is up to you. Created with goals in mind, NikeSkin covers the striking area of the cleat while Nike Cyclone 360 traction helps guide your unscripted agility.Shown: Black/BlackStyle: FJ2585-001",5 Stars,1
FQ3875-001,55,False,55.0,https://www.nike.com/t/alpha-menace-4-shark-football-cleats-wide-kJLfCJ/FQ3875-001,"Change the game in a flash with the Alpha Menace 4 Shark. With breathable mesh and synthetic leather harmonizing perfectly with our Nike Fastflex technology, it can help you make a game-saving tackle or hightail it to pay dirt.Shown: Black/Light Smoke Grey/Metallic Silver/WhiteStyle: FQ3875-001",0 Stars,0
DJ5629-700,100,True,84.97,https://www.nike.com/t/mercurial-superfly-9-academy-turf-high-top-soccer-shoes-pJ76Rf/DJ5629-700,"Instantly tilt the field in the bold design of the Superfly 9 Academy TF. It's loaded with a Zoom Air unit and flexible NikeSkin up top for exceptional touch, so you can dominate in the waning minutes of a match—when it matters most. Fast is in the Air.Shown: Lemonade/BlackStyle: DJ5629-700",4.4 Stars,28
