product_id,full_price,discounted,current_price,product_url,description,ratings,reviews
FB8987-002,130,False,130.0,https://www.nike.com/t/air-max-dn-big-kids-shoes-SjtGM9/FB8987-002,"Say hello to the next generation of Air technology. The Air Max Dn features our Dynamic Air unit system of dual-pressure tubes, creating a bouncy sensation with every step. This results in a futuristic design that's comfortable enough to wear all day. Go ahead—Feel the Unreal.Shown: Particle Grey/Smoke Grey/Wolf Grey/BlackStyle: FB8987-002",5 Stars,20
FJ9510-101,105,False,105.0,https://www.nike.com/t/wio-11-womens-road-running-shoes-slS3PS/FJ9510-101,"Responsive cushioning provides a balanced ride for everyday runs. Experience energy return with a combination of Cushlon 3.0 foam and a full-length Nike Air unit in the midsole. Plus, an elastic midfoot band and spacious forefoot provide an accommodating, comfortable fit.Shown: White/White/Lilac Bloom/Lilac BloomStyle: FJ9510-101",5 Stars,1
DC3729-003,70,True,46.97,https://www.nike.com/t/revolution-6-womens-road-running-shoes-6QLh9B/DC3729-003,"Made with at least 20% recycled material by weight, old materials find new beginnings. Now you can find yours. Set the pace at the start of your running journey with the plush feel of the Nike Revolution 6. We know comfort is key to a successful run, so we made sure your steps are cushioned and flexible for a soft ride. It's an evolution of a favorite, with a breathable design.Shown: Black/Dark Smoke Grey/Cool Grey/WhiteStyle: DC3729-003",4.4 Stars,415
DM8968-002,170,False,170.0,https://www.nike.com/t/zoom-fly-5-mens-road-running-shoes-jGsdSl/DM8968-002,Bridge the gap between your weekend training run and race day in a durable design that can be deployed not just at the starting line of your favorite race but in the days and months after your conquest. It offers comfort and reliability but with a propulsive sensation that’ll help you feel fast and fresh. That kind of versatility is uncommon in the running arena. But who said you can’t have it all?Shown: Black/Sail/Metallic Gold GrainStyle: DM8968-002,4.4 Stars,192
FQ7875-400,130,False,130.0,https://www.nike.com/t/free-golf-nn-golf-shoes-wide-3MqmrK/FQ7875-400,"A blast from the past, the Nike Free Golf uses some of our favorite running footwear technology to make it even more functional than before. It's our lowest-to-the-ground golf shoe, offering freedom when you’re on the hoof or housing an approach shot from deep.Shown: Game Royal/Football Grey/White/Deep Royal BlueStyle: FQ7875-400",4.5 Stars,2
DX9042-401,60,False,60.0,https://www.nike.com/t/tanjun-easyon-little-kids-shoes-x6LQ77/DX9042-401,"Littles start the day on the right foot with the Nike Tanjun EasyOn. The lace area lifts up so kids can easily step into the shoe and secure it with a hook-and-loop closure. No tying needed! A wide base, flexible grooves and foam underfoot all work together so they can run, jump and play with confidence.Shown: Game Royal/White/WhiteStyle: DX9042-401",4.9 Stars,32
FJ2575-100,170,True,153.97,https://www.nike.com/t/phantom-luna-2-pro-fg-high-top-soccer-cleats-2zSsv5/FJ2575-100,"Serious about your game? We made this for you. In the middle of the storm, with chaos swirling all around you, you’ve calmly found the final third of the field, thanks to your uncanny mix of on-ball guile and grace. Go finish the job in the Phantom Luna 2 Pro. Take your skills to the next level with some of Nike’s greatest innovations, like a stretchy Flyknit upper and Nike Cyclone 360 traction to help guide your unscripted agility.Shown: White/Metallic Gold Coin/BlackStyle: FJ2575-100",4.3 Stars,3
DN3577-102,90,False,90.0,https://www.nike.com/t/court-vision-mid-next-nature-mens-shoes-j5K4rb/DN3577-102,In love with the classic look of '80s basketball but have a thing for the fast-paced culture of today's game? Meet the Nike Court Vision Mid. A classic remixed with at least 20% recycled materials by weight. We replaced leather with recycled and synthetic materials that keeps the soul of the original style. Its crisp upper and stitched overlays stays true to its origins. The plush collar keeps it sleek and comfortable for your world.Shown: Summit White/Pure Platinum/White/BicoastalStyle: DN3577-102,4.8 Stars,543
DM9026-107,57,False,57.0,https://www.nike.com/t/omni-multi-court-little-kids-shoes-R4N8R3/DM9026-107,"What’s Omni, you ask? It means universal, inclusive and all. Playtime is about freedom and imagination. As the ultimate play shoe, there are no limits when your kiddo pulls these Nikes on. They’re durable for any indoor court surface and lightweight to help make play comfortable.Shown: White/Vapor Green/Total Orange/Photo BlueStyle: DM9026-107",4.2 Stars,57
5470765926,125,False,125.0,https://www.nike.com/u/custom-phantom-luna-academy-2-by-you-10001769/5470765926,"Looking to take your skills to the next level? Let the Phantom Luna Academy 2 By You help your game shine. With eye- popping underfoot plates, gritty graphics and a plethora of dazzling colors, your skills will catch the gazes of every onlooker both on the field and in the stands. With NikeSkin covering the striking area of the cleat, and Nike Cyclone 360 traction guiding your unscripted agility in the open field, it’s created with goals in mind.Shown: Multi-Color/Multi-ColorStyle: FQ8791-900",No rating available,Review summary tag not found
DV4352-001,40,False,40.0,https://www.nike.com/t/jr-tiempo-legend-10-club-little-big-kids-multi-ground-low-top-soccer-cleats-hBrcbT/DV4352-001,"Even Legends find ways to evolve. Whether you’re starting out or just playing for fun, the latest iteration of these Club cleats gets you on the field without compromising on quality. Synthetic leather conforms to your foot and doesn't overstretch, giving you better control. Lighter and sleeker than any other Tiempo to date, the Legend 10 is for any position on the field, whether you're sending a pinpoint pass through the defense or tracking back to stop a breakaway.Shown: Black/VoltStyle: DV4352-001",4.4 Stars,37
FJ2607-001,52,False,52.0,https://www.nike.com/t/jr-phantom-luna-2-club-little-big-kids-tf-high-top-soccer-shoes-s6q6HC/FJ2607-001,"Whether you’re starting out or just playing for fun, Club shoes get you on the field without compromising on quality. Created with goals in mind, the Jr. Phantom Luna 2 Club has a grippy texture covering the striking area of the shoe and reliable traction to help guide your unscripted agility.Shown: Black/BlackStyle: FJ2607-001",0 Stars,0
DV2436-101,75,True,50.97,https://www.nike.com/t/e-series-ad-mens-shoes-zmnXPP/DV2436-101,"Everyday comfort gets a modern look. The E-Series AD was designed with ease of entry in mind, which will have you reaching for them day after day. Breathable mesh and cushiony foam strike the perfect balance between comfort and support, from that first step to wherever the day takes you.Shown: Light Orewood Brown/White/Khaki/Light BoneStyle: DV2436-101",4.6 Stars,25
FD6476-005,75,False,75.0,https://www.nike.com/t/downshifter-13-womens-road-running-shoes-T2dDgQ/FD6476-005,"Whether you’re starting your running journey or an expert eager to switch up your pace, the Downshifter 13 is down for the ride. With a revamped upper and cushion and durability, it helps you find that extra gear or take that first stride toward chasing down your goals.Shown: Photon Dust/Glacier Blue/Barely Green/BlackStyle: FD6476-005",4.9 Stars,7
DD1094-400,50,True,32.97,https://www.nike.com/t/revolution-6-baby-toddler-shoes-q86rDs/DD1094-400,"We prioritize comfort, especially for our growing athletes on the move. Made with 20% recycled content by weight, you can take these lightweight, and breathable sneakers from all-day play to anytime wear with any outfit.Shown: Midnight Navy/Flat Pewter/WhiteStyle: DD1094-400",4.2 Stars,206
FD6454-104,75,False,75.0,https://www.nike.com/t/downshifter-13-mens-road-running-shoes-4M0LNf/FD6454-104,"Whether you’re starting your running journey or an expert eager to switch up your pace, the Downshifter 13 is down for the ride. With a revamped upper and cushion and durability, it helps you find that extra gear or take that first stride toward chasing down your goals.Shown: White/Light Smoke Grey/Black/Fire RedStyle: FD6454-104",4 Stars,2
DH5089-600,47,False,47.0,https://www.nike.com/t/vapor-edge-shark-2-little-big-kids-football-cleats-rPT6Tz/DH5089-600,"Future football stars will love to dig in with the Nike Vapor Edge Shark 2. With a secure and supportive fit, you'll feel confident making cuts and sprinting to get that 1st down or that game-saving tackle. They're flexible so every step on the field feels natural. Plus, rubber cleats give the traction you need so you're set for every drill, practice and kickoff.Shown: University Red/White/BlackStyle: DH5089-600",4.5 Stars,4
DX9028-102,130,False,130.0,https://www.nike.com/t/victory-pro-3-mens-golf-shoes-wide-SLGNft/DX9028-102,"Made for your triumphant marches down the fairway after striping that drive and surprisingly fresh legs when it’s time to take off the hats, these shoes have an updated design that maintains those true old-school stylings with even more pop, comfort and traction. It’s perfect for a post-work bucket of balls or the foot-wedger hoping to blend in with the group while getting a little closer to the hole.Shown: White/Obsidian/Aquarius Blue/Football GreyStyle: DX9028-102",0 Stars,0
FD6061-002,87,True,60.97,https://www.nike.com/t/infinity-flow-little-kids-shoes-KjQpsq/FD6061-002,"What separates the Infinity Flow from the rest of the pack? For starters, we stacked it with soft and bouncy foam to help cushion every stride your little runner takes. A breathable mesh upper helps keep little feet cool while a hook-and-loop strap lets kiddos secure their fit fast—because play shouldn't have to wait.Shown: Black/Anthracite/Hyper Turquoise/WhiteStyle: FD6061-002",0 Stars,0
DH5128-101,130,True,82.97,https://www.nike.com/t/air-max-bliss-womens-shoes-rJ0q5H/DH5128-101,"For the days when you want to be comfy as well as stylish, all you need to do is grab a pair of these. This shoe is all about flow, with just the right pops of color to add interest to any look. The extra-cushy footbed benefits from Air Max tech, and nature-inspired aesthetic keeps you just grounded enough.Shown: White/White/Summit WhiteStyle: DH5128-101",4.4 Stars,87
DJ5627-300,100,True,85.97,https://www.nike.com/t/mercurial-superfly-9-academy-indoor-court-high-top-soccer-shoes-V1BdWs/DJ5627-300,"Instantly tilt the field in the bold design of the Superfly 9 Academy IC. It's loaded with a Zoom Air unit and flexible NikeSkin up top for exceptional touch, so you can dominate in the waning minutes of a match—when it matters most. Fast is in the Air.Shown: Hyper Turquoise/Black/White/Fuchsia DreamStyle: DJ5627-300",4.4 Stars,14
DJ5959-700,52,False,52.0,https://www.nike.com/t/jr-mercurial-superfly-9-club-little-big-kids-multi-ground-high-top-soccer-cleats-97trcr/DJ5959-700,"Learning the skills, the game and all the drills? Show how far you've come while rocking the Nike Jr. soccer cleats. Designed for versatility from artificial grass to real grass surfaces, they have the traction you need to run and cut on different types of fields. The durable design will hold up when your schedule is all about practice during the week and games on the weekends.Shown: Lemonade/BlackStyle: DJ5959-700",4.7 Stars,56
FD0762-800,160,True,96.97,https://www.nike.com/t/air-max-flyknit-racer-next-nature-mens-shoes-m3NSDB/FD0762-800,"Paying homage to both heritage and innovation, the Nike Air Max Flyknit Racer goes beyond what's expected by blending an icon of the past with an icon of today. Incredibly light and stretchy Flyknit pairs with oh-so-soft cushioning for comfort you have to feel. Lace up and let your feet do the talking.Shown: Total Orange/BlackStyle: FD0762-800",4.4 Stars,17
DH8010-600,130,True,97.97,https://www.nike.com/t/air-max-90-womens-shoes-2ZsM2w/DH8010-600,"Nothing as fly, nothing as comfortable, nothing as proven—the Nike Air Max 90 stays true to its roots with the iconic Waffle sole, stitched overlays and classic TPU accents. Fresh details give a modern look while Max Air cushioning adds comfort to your journey.Shown: Barely Rose/Pink Oxford/Black/Summit WhiteStyle: DH8010-600",4.6 Stars,148
FB7690-600,60,False,60.0,https://www.nike.com/t/revolution-7-little-kids-shoes-TvTNgz/FB7690-600,"Let your kiddo flash, dash and blast into the day with the help of shoes made especially for fun. No, they're not loaded with sugar or toys, but they do come in awesome colors and designs that'll have your little one reaching for them every day of the year.Shown: Pink Foam/Summit White/White/BlackStyle: FB7690-600",4.2 Stars,37
FB7691-601,50,False,50.0,https://www.nike.com/t/revolution-7-baby-toddler-shoes-nvbW1K/FB7691-601,"Let your kiddo flash, dash and blast into the day with the help of shoes made especially for fun. No, they're not loaded with sugar or toys, but they do come in awesome colors and designs that'll have your little one reaching for them every day of the year.Shown: Pinksicle/University Gold/Arctic Orange/Summit WhiteStyle: FB7691-601",4.5 Stars,30
FN0565-001,75,False,75.0,https://www.nike.com/t/infinity-g-nn-golf-shoes-wide-rJL0sM/FN0565-001,"Give your on-course athleticism the full green light in the Infinity G NN. These shoes are perfect for today’s game: sleek and fast. Its running-shoe inspired build can help you uncoil your backswing or uncork a chip from the rough to green. Plus, a revamped outsole pattern is ideal for wet weather.Shown: Black/Smoke Grey/WhiteStyle: FN0565-001",3 Stars,2
DJ5616-700,72,False,72.0,https://www.nike.com/t/jr-mercurial-superfly-9-academy-little-big-kids-turf-high-top-soccer-shoes-X4402S/DJ5616-700,"You've got the skills, you've got the game. Now show them off with the Nike Jr. soccer shoes. Pull tabs and dual straps combine for an easy-on design that eliminates the need for laces and helps get you on the pitch fast. Plus, Zoom Air in the heel helps add extra bounce and comfort to turf fields, so you're ready for every practice, scrimmage and game.Shown: Lemonade/BlackStyle: DJ5616-700",4.8 Stars,20
DJ5963-040,65,False,65.0,https://www.nike.com/t/mercurial-vapor-15-club-multi-ground-low-top-soccer-cleats-WGNRnc/DJ5963-040,The field is yours when you lace up in the light and low-to-the-ground Vapor 15 Club MG. Fast is in the Air.Shown: Black/Hyper Royal/ChromeStyle: DJ5963-040,4.7 Stars,76
DJ5623-600,72,True,60.97,https://www.nike.com/t/jr-mercurial-superfly-9-academy-little-big-kids-multi-ground-high-top-soccer-cleats-bT1RJb/DJ5623-600,"You've got the skills and the game, now show them off with the Nike Jr. soccer cleats. Pull tabs and dual straps combine for an easy-on design that eliminates the need for laces and helps get you on the pitch fast. Plus, a Zoom Air unit adds extra comfort and bounce to a variety of fields—from real grass to artificial grass. Who's ready to sub in?Shown: Bright Crimson/Black/WhiteStyle: DJ5623-600",4.6 Stars,116
FB7689-401,65,False,65.0,https://www.nike.com/t/revolution-7-big-kids-running-shoes-JMnlpj/FB7689-401,"Flash, dash and blast into every day with the help of these Revolution Running Shoes that are made especially for fun. No, they're not loaded with sugar or fireworks, but they do come in awesome colors and designs that'll have you reaching for them every day of the year.Shown: Game Royal/Black/WhiteStyle: FB7689-401",4.3 Stars,34
DV4336-700,140,False,140.0,https://www.nike.com/t/tiempo-legend-10-pro-turf-low-top-soccer-shoes-PbtHQn/DV4336-700,"Even Legends find ways to evolve. Made for those serious about their game, the latest iteration of these Pro shoes has all-new FlyTouch Pro engineered leather. Softer than natural leather, it conforms to your foot and works with All Conditions Control (a grippy texture even in wet weather), so you can dictate the pace of your game. Lighter and sleeker than any other Tiempo to date, the Legend 10 is for any position on the field, whether you're sending a pinpoint pass through the defense or tracking back to stop a breakaway.Shown: Lemonade/Metallic Gold Coin/BlackStyle: DV4336-700",4.3 Stars,14
FJ7765-100,90,False,90.0,https://www.nike.com/t/journey-run-womens-road-running-shoes-RZf7Bn/FJ7765-100,"Enjoy every step, route and jaunt in the Nike Journey Run. It’ll have you striding and smiling on punishing pavements, thanks to extra-high foam stacks and supersoft cushioning. It's so comfy that you'll already be looking forward to lacing 'em up again.Shown: Summit White/Barely Grape/Violet Mist/DaybreakStyle: FJ7765-100",5 Stars,2
DJ6257-106,70,False,70.0,https://www.nike.com/t/tanjun-womens-shoes-lj1St1/DJ6257-106,"Forget the hype. The Nike Tanjun brings you simplicity at its best. Made with at least 20% recycled content and 100% recycled polyester laces, no detail is overlooked on this one. Lightweight. Airy. Comfortable. These are just words. This shoe is all you need.Shown: Light Orewood Brown/Barely Volt/Black/WhiteStyle: DJ6257-106",4.4 Stars,462
DV3808-101,120,True,89.97,https://www.nike.com/t/air-force-1-07-next-nature-womens-shoes-58VkQV/DV3808-101,"This hoops original gives ""fresh air"" a whole new meaning. Breezy canvas, embroidered details and a bouquet of spring colors bring summertime vibes to what you already know and love: Nike Air cushioning, classic construction and style for days.Shown: Summit White/Metallic Silver/BronzineStyle: DV3808-101",4.8 Stars,17
FQ4012-100,47,False,47.0,https://www.nike.com/t/alpha-menace-4-shark-big-kids-football-cleats-55B35P/FQ4012-100,"Change the game in a flash with the Alpha Menace 4 Shark. With breathable mesh and synthetic leather harmonizing perfectly with our Nike Fastflex technology, it can help you make a game-saving tackle or hightail it to pay dirt.Shown: White/Metallic Silver/Photon Dust/BlackStyle: FQ4012-100",0 Stars,0
FB2184-002,45,False,45.0,https://www.nike.com/t/asuna-3-next-nature-womens-slides-Tsj7hf/FB2184-002,"The Asuna gets a utilitarian twist in its 3rd rendition that preserves the iconic comfort while enhancing durability. The padded strap is easily adjustable to accommodate your foot's shape and size, as well as your comfiest socks. The original side lacing system takes a step back for a minimalist strap that makes customizing your fit even simpler. These aren't your average pool slides—but you'll want to wear them there, too.Shown: Light Smoke Grey/Pure Platinum/Light Bone/Bright MandarinStyle: FB2184-002",4.4 Stars,5
DJ5631-700,90,True,64.97,https://www.nike.com/t/mercurial-vapor-15-academy-multi-ground-low-top-soccer-cleats-5DNpWz/DJ5631-700,"The field is yours when you lace up in the Vapor 15 Academy MG. It's loaded with a Zoom Air unit and flexible NikeSkin up top for exceptional touch, so you can dominate in the waning minutes of a match—when it matters most. Fast is in the Air.Shown: Lemonade/BlackStyle: DJ5631-700",4.6 Stars,62
DV2757-003,170,True,79.97,https://www.nike.com/t/cosmic-unity-3-basketball-shoes-0zGs9z/DV2757-003,"Better for your game, designed with sustainability in mind—two things you care about—the Cosmic Unity 3 has a secure, lightweight design for a low-to-the-ground feel. It gives you cloud-like cushioning for explosive speed and quick changes in direction, the difference-makers in a game that’s becoming more extraterrestrial.Shown: Light Silver/Deep Jungle/Honeydew/WhiteStyle: DV2757-003",4.4 Stars,114
DJ6949-103,52,False,52.0,https://www.nike.com/t/future-field-little-big-kids-cleats-bjx3Dw/DJ6949-103,"Football. Baseball. Soccer. Or even running around the field at recess. The best part of the Nike Future Field cleats is that they're meant for all types of field play. They're durable so you can try out all the sports you want. Plus, they're versatile and comfy to wear off the field, too—like, going to get ice cream for a postgame and post-practice treat.Shown: White/Volt/BlackStyle: DJ6949-103",4.7 Stars,57
DX7614-601,52,False,52.0,https://www.nike.com/t/star-runner-4-little-kids-shoes-D8kzVQ/DX7614-601,"Get out the door in a flash with the Star Runner. Loops on the tongue and heel make it easy to open the shoe up wide so little star runners can step in and get going. Soft cushioning in the midsole provides a comfortable, springy return so 1 more round, lap and turn is always an option. The tread grabs at pavement, grass and gravel to give them extra grip while a rubber-wrapped toe toughens up the construction so they can go further in the same pair of Star Runners.Shown: Fierce Pink/Black/Playful Pink/WhiteStyle: DX7614-601",4.6 Stars,102
FJ1221-007,160,False,160.0,https://www.nike.com/t/infinityrn-4-team-mens-road-running-shoes-VXRd3b/FJ1221-007,"Maximum cushioning provides elevated comfort for everyday runs. Experience a soft, rocker-shaped platform made with new ReactX foam underfoot and an ultra-comfortable collar and tongue for a snug feel. Plus, a water-resistant membrane was added to this version to help keep you dry.Shown: Cool Grey/Vegas Gold/WhiteStyle: FJ1221-007",5 Stars,3
FZ6829-303,70,False,70.0,https://www.nike.com/t/revolution-7-womens-road-running-shoes-extra-wide-bt34Qq/FZ6829-303,"We loaded the Revolution 7 with the sort of soft cushioning and support that might change your running world. Stylish as ever, comfortable when the rubber meets the road, and performative for your desired pace, it’s an evolution of a fan favorite that offers a soft, smooth ride.Shown: Barely Green/White/Platinum Tint/Metallic SilverStyle: FZ6829-303",4.3 Stars,4
DZ0503-400,120,False,120.0,https://www.nike.com/t/air-zoom-diamond-elite-turf-mens-baseball-shoes-p4mz9D/DZ0503-400,"Get game-ready with these Diamond Elites or just wear them while spitting seeds and shooting the breeze with your teammates in the dugout. A Zoom Air unit gives you speed in warm-ups, while a forefoot strap helps keep you contained when shagging flies. And the traction pattern works on all pregame surfaces, helping you work on your takeoff from 1st to 2nd or lay out for line-drives in the outfield.Shown: Hyper Royal/Pure Platinum/Polar/WhiteStyle: DZ0503-400",4.7 Stars,3
DV6800-104,130,False,130.0,https://www.nike.com/t/victory-pro-3-mens-golf-shoes-SsxNJ0/DV6800-104,"Made for your triumphant marches down the fairway after striping that drive and surprisingly fresh legs when it’s time to take off the hats, these shoes have an updated design that maintains those true old-school stylings with even more pop, comfort and traction. It’s perfect for a post-work bucket of balls or the foot-wedger hoping to blend in with the group while getting a little closer to the hole.Shown: White/Black/Lightning/Team RedStyle: DV6800-104",4.4 Stars,7
CZ5919-103,32,False,32.0,https://www.nike.com/t/hyperdiamond-4-keystone-gg-big-kids-softball-cleats-z1R2gL/CZ5919-103,Be quick between the bases and nimble on defense in the Nike Hyperdiamond 4 Keystone GG. A rubber outsole with studs gives you traction to help beat the relay throw from the outfield just in time.Shown: White/Photon Dust/Volt/BlackStyle: CZ5919-103,4.8 Stars,354
DJ6258-002,70,False,70.0,https://www.nike.com/t/tanjun-mens-shoes-jQ3z1W/DJ6258-002,"Forget the hype. The Nike Tanjun brings you simplicity at its best. Made with at least 20% recycled content by weight, no detail is overlooked on this one. Lightweight. Airy. Comfortable. This shoe is all you need.Shown: Wolf Grey/Barely Volt/Black/WhiteStyle: DJ6258-002",4.4 Stars,129
DQ0285-111,75,False,75.0,https://www.nike.com/t/air-max-systm-little-kids-shoes-bpKSzc/DQ0285-111,"Cassette mixtapes, music videos and mall arcades—the '80s had it all. We’re celebrating that gnarly era with the Nike Air Max SYSTM. From the big and bold Air unit in the heel to design lines inspired by our favorite throwback Air Max shoes, these kicks are all about bringing back what’s cool and introducing it to a new generation.Shown: Summit White/White/Pure Platinum/Cobalt BlissStyle: DQ0285-111",4.6 Stars,103
DJ7884-006,140,False,140.0,https://www.nike.com/t/structure-25-womens-road-running-shoes-qpkKMs/DJ7884-006,"Supportive cushioning provides steadiness for everyday runs. Experience a stable platform without sacrificing performance with a combination of Cushlon 3.0 foam and a Zoom Air unit. Plus, a higher stack height makes it more comfortable, stable, and supportive than ever.Shown: Black/Daybreak/Lilac Bloom/WhiteStyle: DJ7884-006",4.4 Stars,73
DX7616-004,47,False,47.0,https://www.nike.com/t/star-runner-4-baby-toddler-shoes-7XNnfN/DX7616-004,"Get out the door in a flash with the Star Runner. Loops on the tongue and heel make it easy to open the shoe up wide so little star runners can step in and get going. Soft cushioning in the midsole provides a comfortable, springy feel so 1 more round, lap and turn is always an option. The tread grabs at pavement, grass and gravel to give them extra grip while a rubber-wrapped toe toughens up the construction so they can go further in the same pair of Star Runners.Shown: Black/Summit White/Green Strike/Racer BlueStyle: DX7616-004",4.5 Stars,43
DM8974-401,170,False,170.0,https://www.nike.com/t/zoom-fly-5-womens-road-running-shoes-ShXjdb/DM8974-401,"Bridge the gap between your weekend training run and race day in a durable design that can be deployed not just at the starting line of your favorite race, but in the days and months after your conquest. It offers comfort and reliability but with a propulsive sensation that’ll help you feel fast and fresh. That kind of versatility is uncommon in the running arena. But who said you can’t have it all?Shown: Glacier Blue/Vapor Green/BlackStyle: DM8974-401",4.4 Stars,192
